{"attempt":{"attemptId":"1b2c3d4e-5f6a-4b8c-9d0e-1f2a3b4c5d49","attemptOrdinal":1,"repetitionOrdinal":1},"build":{"artifactDigest":"sha256:0000000000000000000000000000000000000000000000000000000000000002","buildReceiptDigest":"sha256:0000000000000000000000000000000000000000000000000000000000000001","closureFingerprint":"closure-v1-0001","configuration":"shipping","instrumentation":[],"packagingPolicyId":"packaging.server_remote","platformId":"platform.linux","targetId":"rawframe.host.dedicated_server"},"execution":{"cacheState":"warm","clientCount":64,"plannedMeasurementMilliseconds":1800000,"plannedWarmupMilliseconds":60000,"seeds":[1,2,3]},"harness":{"buildId":"harness-v1-0001","configurationDigest":"sha256:0000000000000000000000000000000000000000000000000000000000000007","executableDigest":"sha256:0000000000000000000000000000000000000000000000000000000000000006","harnessId":"rawframe.tool.run_harness"},"metricRegistryGeneration":1,"observations":{"attachments":[{"descriptor":{"byteLength":4194304,"digest":"sha256:0000000000000000000000000000000000000000000000000000000000000008","mediaType":"application/vnd.rawframe.evidence.samples.v1+octet-stream"},"required":true,"role":"raw_samples","sensitivity":"internal"}],"lifecycleEvents":[{"count":2,"eventId":"tick.catch_up","firstOccurrenceNanoseconds":45000000000}],"metrics":[{"metricId":"harness.assertion_failure.count","statistic":"count","unit":"count","value":0},{"metricId":"harness.attachment_missing.count","statistic":"count","unit":"count","value":0},{"metricId":"harness.invariant_violation.count","statistic":"count","unit":"count","value":0},{"metricId":"harness.observation.sample_count","scaleExponent":-3,"statistic":"count","unit":"count","value":108000000},{"metricId":"harness.workload_failure.count","statistic":"count","unit":"count","value":0}],"sampleCount":108000},"profile":{"profileId":"headless_networked_luau_world_v1","workloadFingerprint":"workload-v1-0001"},"recordKind":"raw_run_receipt","runId":"6f1c2d3e-4a5b-4c7d-8e9f-0a1b2c3d4e49","runner":{"cellFingerprint":"cell-v1-0001","observed":{"boostEnabled":false,"cpuModel":"Reference SUT CPU","frequencyGovernor":"performance","imageId":"image-v1-0001","kernelVersion":"6.8.0","measuredCoreIds":[2,3],"memoryLimitBytes":1073741824,"numaNodeCount":1,"operatingSystem":"Linux","physicalCoreCount":8,"simultaneousMultithreading":false,"virtualization":"none"},"runnerGeneration":1},"schemaVersion":1,"source":{"dirty":false,"revision":"973c8f7000000000000000000000000000000000"},"status":"completed","timing":{"monotonicEndNanoseconds":1861000000000,"monotonicStartNanoseconds":1000000000,"wallEndTimestamp":"2026-07-29T10:31:00Z","wallStartTimestamp":"2026-07-29T10:00:00Z"},"toolchain":{"compilerId":"clang-20.1.0","dependencyCatalogDigest":"sha256:0000000000000000000000000000000000000000000000000000000000000004","dependencyLockDigest":"sha256:0000000000000000000000000000000000000000000000000000000000000005","sdkId":"linux-glibc-2.39","toolchainLockDigest":"sha256:0000000000000000000000000000000000000000000000000000000000000003"},"trust":{"provenance":"diagnostic_untrusted"}}